{
  "identity_claim_id": "IC-0002",
  "person_id": "PERSON-0001",
  "record_id": "RR-0002",
  "classification": "POSSIBLE_MATCH",
  "basis": "Exact name and Hetauda-6 match family appeal, but official contact differs and known official row does not establish Chowghada.",
  "supporting_fields": ["name", "ward"],
  "conflicting_fields": ["phone"],
  "confidence": 0.6,
  "review_state": "HUMAN_REVIEW_REQUIRED"
}
