{
  "identity_claim_id": "IC-0003",
  "person_id": "PERSON-0001",
  "record_id": "RR-0003",
  "classification": "POSSIBLE_MATCH",
  "basis": "Hetauda-6 and Chowghada match family appeal, but extended name differs and contact differs.",
  "supporting_fields": ["ward", "locality"],
  "conflicting_fields": ["name", "phone"],
  "confidence": 0.55,
  "review_state": "HUMAN_REVIEW_REQUIRED"
}
