{
  "identity_claim_id": "IC-0004",
  "person_id": "PERSON-0002",
  "record_id": "RR-0003",
  "classification": "PROBABLE_MATCH",
  "basis": "Seed canonical person mirrors the distinct official Suman Thing Lama record pending further identity resolution.",
  "supporting_fields": ["name", "age", "ward", "locality", "vehicle"],
  "conflicting_fields": [],
  "confidence": 0.9,
  "review_state": "HUMAN_REVIEW_REQUIRED"
}
