{
  "identity_claim_id": "IC-0001",
  "person_id": "PERSON-0001",
  "record_id": "RR-0001",
  "classification": "PROBABLE_MATCH",
  "basis": "Seed canonical person is derived from the family appeal record, but remains a working identity cluster until independently confirmed.",
  "supporting_fields": ["name", "ward", "locality"],
  "conflicting_fields": [],
  "confidence": 0.9,
  "review_state": "HUMAN_REVIEW_REQUIRED"
}
